type,typeCode,title
subcategory,T11.1,"Open wound of upper limb, level unspecified"
subcategory,T11.2,"Dislocation, sprain and strain of unspecified joint and ligament of upper limb, level unspecified"
subcategory,T11.3,"Injury of unspecified nerve of upper limb, level unspecified"
subcategory,T11.4,"Injury of unspecified blood vessel of upper limb, level unspecified"
subcategory,T11.5,"Injury of unspecified muscle and tendon of upper limb, level unspecified"
subcategory,T11.6,"Traumatic amputation of upper limb, level unspecified"
subcategory,T11.8,"Other specified injuries of upper limb, level unspecified"
subcategory,T11.9,"Unspecified injury of upper limb, level unspecified"
category,T12,"Fracture of lower limb, level unspecified"
subcategory,T13.0,"Superficial injury of lower limb, level unspecified"
subcategory,T13.1,"Open wound of lower limb, level unspecified"
subcategory,T13.2,"Dislocation, sprain and strain of unspecified joint and ligament of lower limb, level unspecified"
subcategory,T13.3,"Injury of unspecified nerve of lower limb, level unspecified"
subcategory,T13.4,"Injury of unspecified blood vessel of lower limb, level unspecified"
subcategory,T13.5,"Injury of unspecified muscle and tendon of lower limb, level unspecified"
subcategory,T13.6,"Traumatic amputation of lower limb, level unspecified"
subcategory,T13.8,"Other specified injuries of lower limb, level unspecified"
subcategory,T13.9,"Unspecified injury of lower limb, level unspecified"
subcategory,T14.0,"Superficial injury of unspecified body region"
subcategory,T14.1,"Open wound of unspecified body region"
subcategory,T14.2,"Fracture of unspecified body region"
subcategory,T14.3,"Dislocation, sprain and strain of unspecified body region"
subcategory,T14.4,"Injury of nerve(s) of unspecified body region"
subcategory,T14.5,"Injury of blood vessel(s) of unspecified body region"
subcategory,T14.6,"Injury of muscles and tendons of unspecified body region"
subcategory,T14.7,"Crushing injury and traumatic amputation of unspecified body region"
subcategory,T14.8,"Other injuries of unspecified body region"
subcategory,T14.9,"Injury, unspecified"
subcategory,T15.0,"Foreign body in cornea"
subcategory,T15.1,"Foreign body in conjunctival sac"
subcategory,T15.8,"Foreign body in other and multiple parts of external eye"
subcategory,T15.9,"Foreign body on external eye, part unspecified"
category,T16,"Foreign body in ear"
subcategory,T17.0,"Foreign body in nasal sinus"
subcategory,T17.1,"Foreign body in nostril"
subcategory,T17.2,"Foreign body in pharynx"
subcategory,T17.3,"Foreign body in larynx"
subcategory,T17.4,"Foreign body in trachea"
subcategory,T17.5,"Foreign body in bronchus"
subcategory,T17.8,"Foreign body in other and multiple parts of respiratory tract"
subcategory,T17.9,"Foreign body in respiratory tract, part unspecified"
subcategory,T18.0,"Foreign body in mouth"
subcategory,T18.1,"Foreign body in oesophagus"
subcategory,T18.2,"Foreign body in stomach"
subcategory,T18.3,"Foreign body in small intestine"
subcategory,T18.4,"Foreign body in colon"
subcategory,T18.5,"Foreign body in anus and rectum"
subcategory,T18.8,"Foreign body in other and multiple parts of alimentary tract"
subcategory,T18.9,"Foreign body in alimentary tract, part unspecified"
subcategory,T19.0,"Foreign body in urethra"
subcategory,T19.1,"Foreign body in bladder"
subcategory,T19.2,"Foreign body in vulva and vagina"
subcategory,T19.3,"Foreign body in uterus [any part]"
subcategory,T19.8,"Foreign body in other and multiple parts of genitourinary tract"
subcategory,T19.9,"Foreign body in genitourinary tract, part unspecified"
subcategory,T20.0,"Burn of unspecified degree of head and neck"
subcategory,T20.1,"Burn of first degree of head and neck"
subcategory,T20.2,"Burn of second degree of head and neck"
subcategory,T20.3,"Burn of third degree of head and neck"
subcategory,T20.4,"Corrosion of unspecified degree of head and neck"
subcategory,T20.5,"Corrosion of first degree of head and neck"
subcategory,T20.6,"Corrosion of second degree of head and neck"
subcategory,T20.7,"Corrosion of third degree of head and neck"
subcategory,T21.0,"Burn of unspecified degree of trunk"
subcategory,T21.1,"Burn of first degree of trunk"
subcategory,T21.2,"Burn of second degree of trunk"
subcategory,T21.3,"Burn of third degree of trunk"
subcategory,T21.4,"Corrosion of unspecified degree of trunk"
subcategory,T21.5,"Corrosion of first degree of trunk"
subcategory,T21.6,"Corrosion of second degree of trunk"
subcategory,T21.7,"Corrosion of third degree of trunk"
subcategory,T22.0,"Burn of unspecified degree of shoulder and upper limb, except wrist and hand"
subcategory,T22.1,"Burn of first degree of shoulder and upper limb, except wrist and hand"
subcategory,T22.2,"Burn of second degree of shoulder and upper limb, except wrist and hand"
subcategory,T22.3,"Burn of third degree of shoulder and upper limb, except wrist and hand"
subcategory,T22.4,"Corrosion of unspecified degree of shoulder and upper limb, except wrist and hand"
subcategory,T22.5,"Corrosion of first degree of shoulder and upper limb, except wrist and hand"
subcategory,T22.6,"Corrosion of second degree of shoulder and upper limb, except wrist and hand"
subcategory,T22.7,"Corrosion of third degree of shoulder and upper limb, except wrist and hand"
subcategory,T23.0,"Burn of unspecified degree of wrist and hand"
subcategory,T23.1,"Burn of first degree of wrist and hand"
subcategory,T23.2,"Burn of second degree of wrist and hand"
subcategory,T23.3,"Burn of third degree of wrist and hand"
subcategory,T23.4,"Corrosion of unspecified degree of wrist and hand"
subcategory,T23.5,"Corrosion of first degree of wrist and hand"
subcategory,T23.6,"Corrosion of second degree of wrist and hand"
subcategory,T23.7,"Corrosion of third degree of wrist and hand"
subcategory,T24.0,"Burn of unspecified degree of hip and lower limb, except ankle and foot"
subcategory,T24.1,"Burn of first degree of hip and lower limb, except ankle and foot"
subcategory,T24.2,"Burn of second degree of hip and lower limb, except ankle and foot"
subcategory,T24.3,"Burn of third degree of hip and lower limb, except ankle and foot"
subcategory,T24.4,"Corrosion of unspecified degree of hip and lower limb, except ankle and foot"
subcategory,T24.5,"Corrosion of first degree of hip and lower limb, except ankle and foot"
subcategory,T24.6,"Corrosion of second degree of hip and lower limb, except ankle and foot"
subcategory,T24.7,"Corrosion of third degree of hip and lower limb, except ankle and foot"
subcategory,T25.0,"Burn of unspecified degree of ankle and foot"
subcategory,T25.1,"Burn of first degree of ankle and foot"
subcategory,T25.2,"Burn of second degree of ankle and foot"
subcategory,T25.3,"Burn of third degree of ankle and foot"
subcategory,T25.4,"Corrosion of unspecified degree of ankle and foot"
subcategory,T25.5,"Corrosion of first degree of ankle and foot"
subcategory,T25.6,"Corrosion of second degree of ankle and foot"
subcategory,T25.7,"Corrosion of third degree of ankle and foot"
subcategory,T26.0,"Burn of eyelid and periocular area"
subcategory,T26.1,"Burn of cornea and conjunctival sac"
subcategory,T26.2,"Burn with resulting rupture and destruction of eyeball"
subcategory,T26.3,"Burn of other parts of eye and adnexa"
subcategory,T26.4,"Burn of eye and adnexa, part unspecified"
subcategory,T26.5,"Corrosion of eyelid and periocular area"
subcategory,T26.6,"Corrosion of cornea and conjunctival sac"
subcategory,T26.7,"Corrosion with resulting rupture and destruction of eyeball"
subcategory,T26.8,"Corrosion of other parts of eye and adnexa"
subcategory,T26.9,"Corrosion of eye and adnexa, part unspecified"
subcategory,T27.0,"Burn of larynx and trachea"
subcategory,T27.1,"Burn involving larynx and trachea with lung"
subcategory,T27.2,"Burn of other parts of respiratory tract"
subcategory,T27.3,"Burn of respiratory tract, part unspecified"
subcategory,T27.4,"Corrosion of larynx and trachea"
subcategory,T27.5,"Corrosion involving larynx and trachea with lung"
subcategory,T27.6,"Corrosion of other parts of respiratory tract"
subcategory,T27.7,"Corrosion of respiratory tract, part unspecified"
subcategory,T28.0,"Burn of mouth and pharynx"
subcategory,T28.1,"Burn of oesophagus"
subcategory,T28.2,"Burn of other parts of alimentary tract"
subcategory,T28.3,"Burn of internal genitourinary organs"
subcategory,T28.4,"Burn of other and unspecified internal organs"
subcategory,T28.5,"Corrosion of mouth and pharynx"
subcategory,T28.6,"Corrosion of oesophagus"
subcategory,T28.7,"Corrosion of other parts of alimentary tract"
subcategory,T28.8,"Corrosion of internal genitourinary organs"
subcategory,T28.9,"Corrosion of other and unspecified internal organs"
subcategory,T29.0,"Burns of multiple regions, unspecified degree"
subcategory,T29.1,"Burns of multiple regions, no more than first-degree burns mentioned"
subcategory,T29.2,"Burns of multiple regions, no more than second-degree burns mentioned"
subcategory,T29.3,"Burns of multiple regions, at least one burn of third degree mentioned"
subcategory,T29.4,"Corrosions of multiple regions, unspecified degree"
subcategory,T29.5,"Corrosions of multiple regions, no more than first-degree corrosions mentioned"
subcategory,T29.6,"Corrosions of multiple regions, no more than second-degree corrosions mentioned"
subcategory,T29.7,"Corrosions of multiple regions, at least one corrosion of third degree mentioned"
subcategory,T30.0,"Burn of unspecified body region, unspecified degree"
subcategory,T30.1,"Burn of first degree, body region unspecified"
subcategory,T30.2,"Burn of second degree, body region unspecified"
subcategory,T30.3,"Burn of third degree, body region unspecified"
subcategory,T30.4,"Corrosion of unspecified body region, unspecified degree"
subcategory,T30.5,"Corrosion of first degree, body region unspecified"
subcategory,T30.6,"Corrosion of second degree, body region unspecified"
subcategory,T30.7,"Corrosion of third degree, body region unspecified"
subcategory,T31.0,"Burns involving less than 10% of body surface"
subcategory,T31.1,"Burns involving 10-19% of body surface"
subcategory,T31.2,"Burns involving 20-29% of body surface"
subcategory,T31.3,"Burns involving 30-39% of body surface"
subcategory,T31.4,"Burns involving 40-49% of body surface"
subcategory,T31.5,"Burns involving 50-59% of body surface"
subcategory,T31.6,"Burns involving 60-69% of body surface"
subcategory,T31.7,"Burns involving 70-79% of body surface"
subcategory,T31.8,"Burns involving 80-89% of body surface"
subcategory,T31.9,"Burns involving 90% or more of body surface"
subcategory,T32.0,"Corrosions involving less than 10% of body surface"
subcategory,T32.1,"Corrosions involving 10-19% of body surface"
subcategory,T32.2,"Corrosions involving 20-29% of body surface"
subcategory,T32.3,"Corrosions involving 30-39% of body surface"
subcategory,T32.4,"Corrosions involving 40-49% of body surface"
subcategory,T32.5,"Corrosions involving 50-59% of body surface"
subcategory,T32.6,"Corrosions involving 60-69% of body surface"
subcategory,T32.7,"Corrosions involving 70-79% of body surface"
subcategory,T32.8,"Corrosions involving 80-89% of body surface"
subcategory,T32.9,"Corrosions involving 90% or more of body surface"
subcategory,T33.0,"Superficial frostbite of head"
subcategory,T33.1,"Superficial frostbite of neck"
subcategory,T33.2,"Superficial frostbite of thorax"
subcategory,T33.3,"Superficial frostbite of abdominal wall, lower back and pelvis"
subcategory,T33.4,"Superficial frostbite of arm"
subcategory,T33.5,"Superficial frostbite of wrist and hand"
subcategory,T33.6,"Superficial frostbite of hip and thigh"
subcategory,T33.7,"Superficial frostbite of knee and lower leg"
subcategory,T33.8,"Superficial frostbite of ankle and foot"
subcategory,T33.9,"Superficial frostbite of other and unspecified sites"
subcategory,T34.0,"Frostbite with tissue necrosis of head"
subcategory,T34.1,"Frostbite with tissue necrosis of neck"
subcategory,T34.2,"Frostbite with tissue necrosis of thorax"
subcategory,T34.3,"Frostbite with tissue necrosis of abdominal wall, lower back and pelvis"
subcategory,T34.4,"Frostbite with tissue necrosis of arm"
subcategory,T34.5,"Frostbite with tissue necrosis of wrist and hand"
subcategory,T34.6,"Frostbite with tissue necrosis of hip and thigh"
subcategory,T34.7,"Frostbite with tissue necrosis of knee and lower leg"
subcategory,T34.8,"Frostbite with tissue necrosis of ankle and foot"
subcategory,T34.9,"Frostbite with tissue necrosis of other and unspecified sites"
subcategory,T35.0,"Superficial frostbite involving multiple body regions"
subcategory,T35.1,"Frostbite with tissue necrosis involving multiple body regions"
subcategory,T35.2,"Unspecified frostbite of head and neck"
subcategory,T35.3,"Unspecified frostbite of thorax, abdomen, lower back and pelvis"
subcategory,T35.4,"Unspecified frostbite of upper limb"
subcategory,T35.5,"Unspecified frostbite of lower limb"
subcategory,T35.6,"Unspecified frostbite involving multiple body regions"
subcategory,T35.7,"Unspecified frostbite of unspecified site"
subcategory,T36.0,"Poisoning: Penicillins"
subcategory,T36.1,"Poisoning: Cefalosporins and other beta-lactam antibiotics"
subcategory,T36.2,"Poisoning: Chloramphenicol group"
subcategory,T36.3,"Poisoning: Macrolides"
subcategory,T36.4,"Poisoning: Tetracyclines"
subcategory,T36.5,"Poisoning: Aminoglycosides"
subcategory,T36.6,"Poisoning: Rifamycins"
subcategory,T36.7,"Poisoning: Antifungal antibiotics, systemically used"
subcategory,T36.8,"Poisoning: Other systemic antibiotics"
subcategory,T36.9,"Poisoning: Systemic antibiotic, unspecified"
subcategory,T37.0,"Poisoning: Sulfonamides"
subcategory,T37.1,"Poisoning: Antimycobacterial drugs"
subcategory,T37.2,"Poisoning: Antimalarials and drugs acting on other blood protozoa"
subcategory,T37.3,"Poisoning: Other antiprotozoal drugs"
subcategory,T37.4,"Poisoning: Anthelminthics"
subcategory,T37.5,"Poisoning: Antiviral drugs"
subcategory,T37.8,"Poisoning: Other specified systemic anti-infectives and antiparasitics"
subcategory,T37.9,"Poisoning: Systemic anti-infective and antiparasitic, unspecified"
subcategory,T38.0,"Poisoning: Glucocorticoids and synthetic analogues"
subcategory,T38.1,"Poisoning: Thyroid hormones and substitutes"
subcategory,T38.2,"Poisoning: Antithyroid drugs"
subcategory,T38.3,"Poisoning: Insulin and oral hypoglycaemic [antidiabetic] drugs"
subcategory,T38.4,"Poisoning: Oral contraceptives"
subcategory,T38.5,"Poisoning: Other estrogens and progestogens"
subcategory,T38.6,"Poisoning: Antigonadotrophins, antiestrogens, antiandrogens, not elsewhere classified"
subcategory,T38.7,"Poisoning: Androgens and anabolic congeners"
subcategory,T38.8,"Poisoning: Other and unspecified hormones and their synthetic substitutes"
subcategory,T38.9,"Poisoning: Other and unspecified hormone antagonists"
subcategory,T39.0,"Poisoning: Salicylates"
subcategory,T39.1,"Poisoning: 4-Aminophenol derivatives"
subcategory,T39.2,"Poisoning: Pyrazolone derivatives"
subcategory,T39.3,"Poisoning: Other nonsteroidal anti-inflammatory drugs [NSAID]"
subcategory,T39.4,"Poisoning: Antirheumatics, not elsewhere classified"
subcategory,T39.8,"Poisoning: Other nonopioid analgesics and antipyretics, not elsewhere classified"
subcategory,T39.9,"Poisoning: Nonopioid analgesic, antipyretic and antirheumatic, unspecified"
subcategory,T40.0,"Poisoning: Opium"
subcategory,T40.1,"Poisoning: Heroin"
subcategory,T40.2,"Poisoning: Other opioids"
subcategory,T40.3,"Poisoning: Methadone"
subcategory,T40.4,"Poisoning: Other synthetic narcotics"
subcategory,T40.5,"Poisoning: Cocaine"
subcategory,T40.6,"Poisoning: Other and unspecified narcotics"
subcategory,T40.7,"Poisoning: Cannabis (derivatives)"
subcategory,T40.8,"Poisoning: Lysergide [LSD]"
subcategory,T40.9,"Poisoning: Other and unspecified psychodysleptics [hallucinogens]"
subcategory,T41.0,"Poisoning: Inhaled anaesthetics"
subcategory,T41.1,"Poisoning: Intravenous anaesthetics"
subcategory,T41.2,"Poisoning: Other and unspecified general anaesthetics"
subcategory,T41.3,"Poisoning: Local anaesthetics"
subcategory,T41.4,"Poisoning: Anaesthetic, unspecified"
subcategory,T41.5,"Poisoning: Therapeutic gases"
subcategory,T42.0,"Poisoning: Hydantoin derivatives"
subcategory,T42.1,"Poisoning: Iminostilbenes"
subcategory,T42.2,"Poisoning: Succinimides and oxazolidinediones"
subcategory,T42.3,"Poisoning: Barbiturates"
subcategory,T42.4,"Poisoning: Benzodiazepines"
subcategory,T42.5,"Poisoning: Mixed antiepileptics, not elsewhere classified"
subcategory,T42.6,"Poisoning: Other antiepileptic and sedative-hypnotic drugs"
subcategory,T42.7,"Poisoning: Antiepileptic and sedative-hypnotic drugs, unspecified"
subcategory,T42.8,"Poisoning: Antiparkinsonism drugs and other central muscle-tone depressants"
subcategory,T43.0,"Poisoning: Tricyclic and tetracyclic antidepressants"
subcategory,T43.1,"Poisoning: Monoamine-oxidase-inhibitor antidepressants"
subcategory,T43.2,"Poisoning: Other and unspecified antidepressants"
subcategory,T43.3,"Poisoning: Phenothiazine antipsychotics and neuroleptics"
subcategory,T43.4,"Poisoning: Butyrophenone and thioxanthene neuroleptics"
subcategory,T43.5,"Poisoning: Other and unspecified antipsychotics and neuroleptics"
subcategory,T43.6,"Poisoning: Psychostimulants with abuse potential"
subcategory,T43.8,"Poisoning: Other psychotropic drugs, not elsewhere classified"
subcategory,T43.9,"Poisoning: Psychotropic drug, unspecified"
subcategory,T44.0,"Poisoning: Anticholinesterase agents"
subcategory,T44.1,"Poisoning: Other parasympathomimetics [cholinergics]"
subcategory,T44.2,"Poisoning: Ganglionic blocking drugs, not elsewhere classified"
subcategory,T44.3,"Poisoning: Other parasympatholytics [anticholinergics and antimuscarinics] and spasmolytics, not elsewhere classified"
subcategory,T44.4,"Poisoning: Predominantly alpha-adrenoreceptor agonists, not elsewhere classified"
subcategory,T44.5,"Poisoning: Predominantly beta-adrenoreceptor agonists, not elsewhere classified"
subcategory,T44.6,"Poisoning: Alpha-adrenoreceptor antagonists, not elsewhere classified"
subcategory,T44.7,"Poisoning: Beta-adrenoreceptor antagonists, not elsewhere classified"
subcategory,T44.8,"Poisoning: Centrally acting and adrenergic-neuron-blocking agents, not elsewhere classified"
subcategory,T44.9,"Poisoning: Other and unspecified drugs primarily affecting the autonomic nervous system"
subcategory,T45.0,"Poisoning: Antiallergic and antiemetic drugs"
subcategory,T45.1,"Poisoning: Antineoplastic and immunosuppressive drugs"
subcategory,T45.2,"Poisoning: Vitamins, not elsewhere classified"
subcategory,T45.3,"Poisoning: Enzymes, not elsewhere classified"
subcategory,T45.4,"Poisoning: Iron and its compounds"
subcategory,T45.5,"Poisoning: Anticoagulants"
subcategory,T45.6,"Poisoning: Fibrinolysis-affecting drugs"
subcategory,T45.7,"Poisoning: Anticoagulant antagonists, vitamin K and other coagulants"
subcategory,T45.8,"Poisoning: Other primarily systemic and haematological agents"
subcategory,T45.9,"Poisoning: Primarily systemic and haematological agent, unspecified"
subcategory,T46.0,"Poisoning: Cardiac-stimulant glycosides and drugs of similar action"
subcategory,T46.1,"Poisoning: Calcium-channel blockers"
subcategory,T46.2,"Poisoning: Other antidysrhythmic drugs, not elsewhere classified"
subcategory,T46.3,"Poisoning: Coronary vasodilators, not elsewhere classified"
subcategory,T46.4,"Poisoning: Angiotensin-converting-enzyme inhibitors"
subcategory,T46.5,"Poisoning: Other antihypertensive drugs, not elsewhere classified"
subcategory,T46.6,"Poisoning: Antihyperlipidaemic and antiarteriosclerotic drugs"
subcategory,T46.7,"Poisoning: Peripheral vasodilators"
subcategory,T46.8,"Poisoning: Antivaricose drugs, including sclerosing agents"
subcategory,T46.9,"Poisoning: Other and unspecified agents primarily affecting the cardiovascular system"
subcategory,T47.0,"Poisoning: Histamine H 2 -receptor antagonists"
subcategory,T47.1,"Poisoning: Other antacids and anti-gastric-secretion drugs"
subcategory,T47.2,"Poisoning: Stimulant laxatives"
subcategory,T47.3,"Poisoning: Saline and osmotic laxatives"
subcategory,T47.4,"Poisoning: Other laxatives"
subcategory,T47.5,"Poisoning: Digestants"
subcategory,T47.6,"Poisoning: Antidiarrhoeal drugs"
subcategory,T47.7,"Poisoning: Emetics"
subcategory,T47.8,"Poisoning: Other agents primarily affecting the gastrointestinal system"
subcategory,T47.9,"Poisoning: Agent primarily affecting the gastrointestinal system, unspecified"
subcategory,T48.0,"Poisoning: Oxytocic drugs"
subcategory,T48.1,"Poisoning: Skeletal muscle relaxants [neuromuscular blocking agents]"
subcategory,T48.2,"Poisoning: Other and unspecified agents primarily acting on muscles"
subcategory,T48.3,"Poisoning: Antitussives"
subcategory,T48.4,"Poisoning: Expectorants"
subcategory,T48.5,"Poisoning: Anti-common-cold drugs"
subcategory,T48.6,"Poisoning: Antiasthmatics, not elsewhere classified"
subcategory,T48.7,"Poisoning: Other and unspecified agents primarily acting on the respiratory system"
subcategory,T49.0,"Poisoning: Local antifungal, anti-infective and anti-inflammatory drugs, not elsewhere classified"
subcategory,T49.1,"Poisoning: Antipruritics"
subcategory,T49.2,"Poisoning: Local astringents and local detergents"
subcategory,T49.3,"Poisoning: Emollients, demulcents and protectants"
subcategory,T49.4,"Poisoning: Keratolytics, keratoplastics and other hair treatment drugs and preparations"
subcategory,T49.5,"Poisoning: Ophthalmological drugs and preparations"
subcategory,T49.6,"Poisoning: Otorhinolaryngological drugs and preparations"
subcategory,T49.7,"Poisoning: Dental drugs, topically applied"
subcategory,T49.8,"Poisoning: Other topical agents"
subcategory,T49.9,"Poisoning: Topical agent, unspecified"
subcategory,T50.0,"Poisoning: Mineralocorticoids and their antagonists"
subcategory,T50.1,"Poisoning: Loop [high-ceiling] diuretics"
subcategory,T50.2,"Poisoning: Carbonic-anhydrase inhibitors, benzothiadiazides and other diuretics"
subcategory,T50.3,"Poisoning: Electrolytic, caloric and water-balance agents"
subcategory,T50.4,"Poisoning: Drugs affecting uric acid metabolism"
subcategory,T50.5,"Poisoning: Appetite depressants"
subcategory,T50.6,"Poisoning: Antidotes and chelating agents, not elsewhere classified"
subcategory,T50.7,"Poisoning: Analeptics and opioid receptor antagonists"
subcategory,T50.8,"Poisoning: Diagnostic agents"
subcategory,T50.9,"Poisoning: Other and unspecified drugs, medicaments and biological substances"
subcategory,T51.0,"Toxic effect: Ethanol"
subcategory,T51.1,"Toxic effect: Methanol"
subcategory,T51.2,"Toxic effect: 2-Propanol"
subcategory,T51.3,"Toxic effect: Fusel oil"
subcategory,T51.8,"Toxic effect: Other alcohols"
subcategory,T51.9,"Toxic effect: Alcohol, unspecified"
subcategory,T52.0,"Toxic effect: Petroleum products"
subcategory,T52.1,"Toxic effect: Benzene"
subcategory,T52.2,"Toxic effect: Homologues of benzene"
subcategory,T52.3,"Toxic effect: Glycols"
subcategory,T52.4,"Toxic effect: Ketones"
subcategory,T52.8,"Toxic effect: Other organic solvents"
subcategory,T52.9,"Toxic effect: Organic solvent, unspecified"
subcategory,T53.0,"Toxic effect: Carbon tetrachloride"
subcategory,T53.1,"Toxic effect: Chloroform"
subcategory,T53.2,"Toxic effect: Trichloroethylene"
subcategory,T53.3,"Toxic effect: Tetrachloroethylene"
subcategory,T53.4,"Toxic effect: Dichloromethane"
subcategory,T53.5,"Toxic effect: Chlorofluorocarbons"
subcategory,T53.6,"Toxic effect: Other halogen derivatives of aliphatic hydrocarbons"
subcategory,T53.7,"Toxic effect: Other halogen derivatives of aromatic hydrocarbons"
subcategory,T53.9,"Toxic effect: Halogen derivative of aliphatic and aromatic hydrocarbons, unspecified"
subcategory,T54.0,"Toxic effect: Phenol and phenol homologues"
subcategory,T54.1,"Toxic effect: Other corrosive organic compounds"
subcategory,T54.2,"Toxic effect: Corrosive acids and acid-like substances"
subcategory,T54.3,"Toxic effect: Corrosive alkalis and alkali-like substances"
subcategory,T54.9,"Toxic effect: Corrosive substance, unspecified"
category,T55,"Toxic effect of soaps and detergents"
subcategory,T56.0,"Toxic effect: Lead and its compounds"
subcategory,T56.1,"Toxic effect: Mercury and its compounds"
subcategory,T56.2,"Toxic effect: Chromium and its compounds"
subcategory,T56.3,"Toxic effect: Cadmium and its compounds"
subcategory,T56.4,"Toxic effect: Copper and its compounds"
subcategory,T56.5,"Toxic effect: Zinc and its compounds"
subcategory,T56.6,"Toxic effect: Tin and its compounds"
subcategory,T56.7,"Toxic effect: Beryllium and its compounds"
subcategory,T56.8,"Toxic effect: Other metals"
subcategory,T56.9,"Toxic effect: Metal, unspecified"
subcategory,T57.0,"Toxic effect: Arsenic and its compounds"
subcategory,T57.1,"Toxic effect: Phosphorus and its compounds"
subcategory,T57.2,"Toxic effect: Manganese and its compounds"
subcategory,T57.3,"Toxic effect: Hydrogen cyanide"
subcategory,T57.8,"Toxic effect: Other specified inorganic substances"
subcategory,T57.9,"Toxic effect: Inorganic substance, unspecified"
category,T58,"Toxic effect of carbon monoxide"
subcategory,T59.0,"Toxic effect: Nitrogen oxides"
subcategory,T59.1,"Toxic effect: Sulfur dioxide"
subcategory,T59.2,"Toxic effect: Formaldehyde"
subcategory,T59.3,"Toxic effect: Lacrimogenic gas"
subcategory,T59.4,"Toxic effect: Chlorine gas"
subcategory,T59.5,"Toxic effect: Fluorine gas and hydrogen fluoride"
subcategory,T59.6,"Toxic effect: Hydrogen sulfide"
subcategory,T59.7,"Toxic effect: Carbon dioxide"
subcategory,T59.8,"Toxic effect: Other specified gases, fumes and vapours"
subcategory,T59.9,"Toxic effect: Gases, fumes and vapours, unspecified"
subcategory,T60.0,"Toxic effect: Organophosphate and carbamate insecticides"
subcategory,T60.1,"Toxic effect: Halogenated insecticides"
subcategory,T60.2,"Toxic effect: Other and unspecified insecticides"
